### ISSUE TITLE
Core dump when starting without an internet connection

### ISSUE THREAD

**Issue by argilo** [gqrx-sdr/gqrx#131]
When I attempt to start up gqrx without a network connection, I get the following error:

linux; GNU C++ version 4.8.1; Boost_105300; UHD_003.005.004-0-unknown

gr-osmosdr v0.1.x-xxx-xunknown (0.1.1git) gnuradio 3.7.2
built-in source types: file osmosdr fcd rtl rtl_tcp uhd hackrf bladerf netsdr 
Using Volk machine: sse4_2_64_orc
terminate called after throwing an instance of 'boost::exception_detail::clone_implboost::exception_detail::error_info_injector<boost::system::system_error >'
  what():  resolve: Host not found (authoritative)
Aborted (core dumped)

Once a network connection is turned on, gqrx starts up normally.  I haven't yet had time to dig into the problem, but I did do a tcpdump to see what gqrx is doing on startup when a network connection is available, and it appears to send a couple UDP packets on ports 49152 (a USRP port) and 48321 (not sure what this is):

08:27:11.443229 IP 192.168.1.51.58349 > 192.168.1.255.49152: UDP, length 36
08:27:11.443750 IP 192.168.1.51.27886 > dns.pppoe.ca.domain: 23788+ PTR? 255.1.168.192.in-addr.arpa. (44)
08:27:11.443781 IP 192.168.1.51.27886 > dns2.pppoe.ca.domain: 23788+ PTR? 255.1.168.192.in-addr.arpa. (44)
08:27:11.462728 IP 192.168.1.51.7644 > dns.pppoe.ca.domain: 17114+ PTR? 170.154.248.206.in-addr.arpa. (46)
08:27:11.464707 IP 192.168.1.51 > dns2.pppoe.ca: ICMP 192.168.1.51 udp port 27886 unreachable, length 139
08:27:11.552389 IP 192.168.1.51.48322 > 255.255.255.255.48321: UDP, length 56
08:27:11.552850 IP 192.168.1.51.17618 > dns.pppoe.ca.domain: 63509+ PTR? 255.255.255.255.in-addr.arpa. (46)
08:27:11.770837 IP 192.168.1.51.52994 > 192.168.1.255.49152: UDP, length 36
08:27:11.879546 IP 192.168.1.51.48322 > 255.255.255.255.48321: UDP, length 56
